platform,job_title,category,skills_required,job_type,budget_usd,location_preference,duration_estimate,url
Freelancer.com,Indeed recruiter needed with employer account.  -- 2,Mixed,"Data Entry, Excel, LinkedIn Recruiting, Recruitment, Virtual Assistant",Fixed,3,Worldwide,Short-term,https://www.freelancer.com/projects/data-entry/indeed-recruiter-needed-with-employer-39549312
Freelancer.com,WooCommerce Mobile App Deployment,Mixed,"Android, iPhone, Mobile App Development, PHP, WordPress",Fixed,534,Worldwide,Short-term,https://www.freelancer.com/projects/android/woocommerce-mobile-app-deployment
Freelancer.com,Elegant Handwritten Signature Design,Mixed,"Graphic Design, Illustrator, Logo Design, Photoshop, Photoshop Design",Fixed,14,Worldwide,Short-term,https://www.freelancer.com/projects/graphic-design/elegant-handwritten-signature-design-39549306
Freelancer.com,Handwritten Notes Typing - 26/06/2025 05:27 EDT,Mixed,"Copy Typing, Data Entry, Excel, PDF, Word",Fixed,11,Worldwide,Short-term,https://www.freelancer.com/projects/copy-typing/handwritten-notes-typing-edt-39548857
Freelancer.com,Electronics Repair Technician in Dubai,Mixed,"Appliance Repair, Electrical Engineering, Electronics, Electronics repair, Engineering",Fixed,200,Worldwide,Short-term,https://www.freelancer.com/projects/electrical-engineering/electronics-repair-technician-dubai
Freelancer.com,Professional Award-winning Video Presenter Services,Mixed,"After Effects, Animation, Video Editing, Video Production, Video Services",Fixed,53,Worldwide,Short-term,https://www.freelancer.com/projects/video-editing/professional-award-winning-video
Freelancer.com,Website QA Testing /// Singapore,Mixed,"Testing / QA, Usability Testing, UX / User Experience, Website Testing",Fixed,20,Worldwide,Short-term,https://www.freelancer.com/projects/testing-qa/website-testing-singapore-39549301
Freelancer.com,Arrange Meetings with Food Creators -- 2,Mixed,"Lead Generation, Sales",Fixed,150,Worldwide,Short-term,https://www.freelancer.com/projects/sales/arrange-meetings-with-food-creators-39549300
Freelancer.com,Job Posting Specialist for LinkedIn & Indeed -- 3,Mixed,"Data Entry, Excel, LinkedIn Recruiting, Recruitment, Virtual Assistant",Fixed,3,Worldwide,Short-term,https://www.freelancer.com/projects/data-entry/job-posting-specialist-for-linkedin-39549299
Freelancer.com,AI Software Explainer Animation,Mixed,"2D Animation, After Effects, Animation, Graphic Design, Motion Design, Motion Graphics",Fixed,140,Worldwide,Short-term,https://www.freelancer.com/contest/ai-software-explainer-animation-2581115
Freelancer.com,E-commerce Site Development,Mixed,"eCommerce, HTML, PHP, Website Design, WordPress",Fixed,32,Worldwide,Short-term,https://www.freelancer.com/projects/ecommerce/commerce-site-development-39549292
Freelancer.com,Podcast Editing in Ableton,Mixed,"Audio Production, Audio Services, Music, Sound Design, Voice Talent",Fixed,17,Worldwide,Short-term,https://www.freelancer.com/projects/audio-services/podcast-editing-ableton
Freelancer.com,Experienced SEO Agency Needed to Boost Online Visibility for Leading UAE Recruitment Firm,Mixed,"Internet Marketing, Link Building, Marketing, Search Engine Marketing, SEO",Fixed,352,Worldwide,Short-term,https://www.freelancer.com/projects/seo/experienced-seo-agency-needed-boost
Freelancer.com,short and engaging video presentation of a website I’ve designed.,Mixed,"After Effects, Graphic Design, Logo Design, Photoshop, Video Editing",Fixed,25,Worldwide,Short-term,https://www.freelancer.com/projects/graphic-design/short-engaging-video-presentation
Freelancer.com,"Telecaller Needed – Reconnect with Non-Returning Salon Customers (English, Kannada & Hindi)",Mixed,"Sales, Telemarketing",Fixed,355,Worldwide,Short-term,https://www.freelancer.com/projects/telemarketing/telecaller-needed-reconnect-with-non
Freelancer.com,Data Engineer/DevOps Specialist,Mixed,"Amazon Web Services, AWS Lambda, Big Data Sales, Java, PySpark, Python",Fixed,320,Worldwide,Short-term,https://www.freelancer.com/projects/python/data-engineer-devops-specialist
Freelancer.com,"Engaging Business Pitch PPT Design, bid with actual price",Mixed,"Brochure Design, Content Writing, Graphic Design, Powerpoint, Presentations",Fixed,20,Worldwide,Short-term,https://www.freelancer.com/projects/powerpoint/engaging-business-pitch-ppt-design
Freelancer.com,Banner design x 2,Mixed,"Banner Design, Graphic Design, Logo Design, Photoshop, Photoshop Design",Fixed,37,Worldwide,Short-term,https://www.freelancer.com/projects/graphic-design/banner-design-39549279
Freelancer.com,LinkedIn Lead Gen Specialist,Mixed,"Data Entry, Internet Marketing, Leads, Research, Web Search",Fixed,263,Worldwide,Short-term,https://www.freelancer.com/projects/leads/linkedin-lead-gen-specialist
Freelancer.com,Comprehensive Social Media Management  -- 63612  --  -- 96128,Mixed,"Content Writing, Facebook Marketing, Internet Marketing, Marketing, Social Networking",Fixed,5,Worldwide,Short-term,https://www.freelancer.com/projects/internet-marketing/comprehensive-social-media-management-39549276
Freelancer.com,Blog Site Development on WordPress,Mixed,"HTML, PHP, SEO, Website Design, WordPress",Fixed,19,Worldwide,Short-term,https://www.freelancer.com/projects/wordpress/blog-site-development-wordpress
Freelancer.com,Sell High-Impact Patent-Pending Inventions,Mixed,"Business Development, Intellectual Property Law, Market Research, Marketing, Patents",Fixed,21089,Worldwide,Short-term,https://www.freelancer.com/projects/patents/sell-high-impact-patent-pending
Freelancer.com,Covert 80 PHP Pages POS System  to React,Mixed,"API, PHP, React.js, REST API, Tailwind CSS, Web API",Fixed,466,Worldwide,Short-term,https://www.freelancer.com/projects/php/covert-php-pages-pos-system
Freelancer.com,Event Video Editing,Mixed,"After Effects, Video Editing, Video Production, Video Services, Videography",Fixed,218,Worldwide,Short-term,https://www.freelancer.com/projects/video-services/event-video-editing-39549270
Freelancer.com,Lead Gen Specialist for Video Services,Mixed,"Email Marketing, Facebook Marketing, Inside Sales, Internet Marketing, Lead Generation, Leads, Marketing, Sales, Social Media Marketing, YouTube",Fixed,242,Worldwide,Short-term,https://www.freelancer.com/projects/facebook-marketing/lead-gen-specialist-for-video
Freelancer.com,ERP Sales Partner on Commission basis (India),Mixed,"B2B Marketing, Branding, Digital Marketing, Enterprise Sales Management, ERP, Lead Generation, Market Analysis, Market Sizing, SaaS Sales, Social Media Marketing",Fixed,263,Worldwide,Short-term,https://www.freelancer.com/projects/b2b-marketing/erp-sales-partner-commission-basis
Freelancer.com,Modern Product Ad Image,Mixed,"Banner Design, Graphic Design, Illustrator, Photoshop, Photoshop Design",Fixed,12,Worldwide,Short-term,https://www.freelancer.com/projects/graphic-design/modern-product-image
Freelancer.com,Minimalist Script Logo for SwiftAI,Mixed,"Graphic Design, Icon Design, Illustrator, Photoshop",Fixed,14,Worldwide,Short-term,https://www.freelancer.com/projects/graphic-design/minimalist-script-logo-for-swiftai
Freelancer.com,B2B Lead Generation Telecaller,Mixed,"Customer Service, Customer Support, Leads, Sales, Technology Sales, Telemarketing",Fixed,93,Worldwide,Short-term,https://www.freelancer.com/projects/customer-service/lead-generation-telecaller
Freelancer.com,Looking for Work in Visual Components,Mixed,"3D Modelling, Blender",Fixed,29,Worldwide,Short-term,https://www.freelancer.com/projects/blender/looking-for-work-visual-components
Freelancer.com,Logo Design for Skineral - A Himalayan Skincare Brand,Mixed,"3D Design, Graphic Design, Illustrator, Logo Design, Photoshop",Fixed,20,Worldwide,Short-term,https://www.freelancer.com/contest/logo-design-for-skineral-a-himalayan-skincare-brand-2581102
Freelancer.com,Restore CraftCMS Website,Mixed,"Graphic Design, HTML, MySQL, PHP, Website Design",Fixed,80,Worldwide,Short-term,https://www.freelancer.com/projects/php/restore-craftcms-website
Freelancer.com,Kid Voice Over for Animation,Mixed,"Animation, Audio Production, Audio Services, Commercials, Voice Talent",Fixed,250,Worldwide,Short-term,https://www.freelancer.com/projects/voice-talent/kid-voice-over-for-animation
Freelancer.com,Mediation Centre Marketing Campaign,Mixed,"Facebook Marketing, Internet Marketing, Marketing, SEO, Social Media Marketing",Fixed,18,Worldwide,Short-term,https://www.freelancer.com/projects/internet-marketing/mediation-centre-marketing-campaign-39549237
